{
  "$schema": "https://json-schema.org/draft/2020-12/schema",
  "$id": "https://research-harness.dev/schema/goal.schema.json",
  "title": "Research Session Goal",
  "description": "The session contract (SPEC §2, §6b): a measurable, transcript-verifiable completion condition the orchestrator runs toward. HARNESS-SIDE, not MIF (SPEC §8b): it references MIF finding @ids but is not itself a MIF concept. Authored by the goal-writer command from the user's raw ask.",
  "type": "object",
  "required": ["goal_statement", "completion_condition", "dimensions"],
  "additionalProperties": false,
  "properties": {
    "$schema": { "type": "string" },
    "topic": {
      "type": "string",
      "pattern": "^[a-z0-9][a-z0-9-]*$",
      "description": "The topic id this session researches (maps to a harness.config topic)."
    },
    "goal_statement": {
      "type": "string",
      "minLength": 1,
      "description": "The one decision this session exists to enable. Not 'learn about X' — 'enable decision Y'."
    },
    "scope": {
      "type": "object",
      "additionalProperties": false,
      "properties": {
        "in_scope": { "type": "array", "items": { "type": "string" } },
        "out_of_scope": { "type": "array", "items": { "type": "string" } },
        "non_goals": { "type": "array", "items": { "type": "string" } }
      }
    },
    "dimensions": {
      "type": "array",
      "minItems": 1,
      "description": "The config-declared dimensions this session fans out across.",
      "items": { "type": "string", "pattern": "^[a-z][a-z0-9_-]*$" }
    },
    "completion_condition": {
      "type": "object",
      "description": "The checkable end state. Each check is a transcript-verifiable fact, not a step.",
      "required": ["summary", "checks"],
      "additionalProperties": false,
      "properties": {
        "summary": { "type": "string", "minLength": 1 },
        "checks": {
          "type": "array",
          "minItems": 1,
          "items": {
            "type": "object",
            "required": ["id", "assertion"],
            "additionalProperties": false,
            "properties": {
              "id": { "type": "string", "pattern": "^[a-z0-9][a-z0-9_-]*$" },
              "assertion": { "type": "string", "minLength": 1 },
              "verify": {
                "type": "string",
                "description": "Optional command or printable fact that proves the assertion."
              }
            }
          }
        }
      }
    },
    "deliverables": {
      "type": "object",
      "description": "Optional up-front declaration of the desired deliverable output shapes (research-harness-template#626), elicited interactively by /goal-writer via AskUserQuestion — never invented, never a placeholder. The engine path (research-goal.js) never elicits this field itself: it only preserves an existing value verbatim on --reshape, or leaves it absent on a fresh author. Consumed by research-pipeline.js: `genres[]` drives the Project phase's per-genre canonical-report loop (each genre renders reports/<topic>/<topic>.<genre>.md via research-projection.js); `genres[]`/`channels[]` are the Deliver phase's (research-deliverables.js) fallback source when the caller passes no CLI --genres/--channels — an explicit CLI arg always wins over this field.",
      "additionalProperties": false,
      "properties": {
        "genres": {
          "type": "array",
          "minItems": 1,
          "items": { "type": "string", "pattern": "^[a-z][a-z0-9-]*$" },
          "description": "Requested deliverable genre pack ids (e.g. 'engineering', 'exec-summary') — each must be an enabled pack (harness.config.json packs[]) at render time, or the pipeline falls back to genre=\"general\" honestly rather than silently claiming an unearned genre (#633)."
        },
        "channels": {
          "type": "array",
          "minItems": 1,
          "items": { "type": "string", "pattern": "^[a-z][a-z0-9-]*$" },
          "description": "Requested deliverable channels (e.g. 'blog', 'pdf') for the Deliver phase's genre x channel render matrix (research-deliverables.js)."
        }
      }
    },
    "bound": {
      "type": "object",
      "description": "The turn/coverage bound at which the session stops even if the goal is not fully met.",
      "additionalProperties": false,
      "properties": {
        "max_rounds": { "type": "integer", "minimum": 1 },
        "min_dimensions_complete": { "type": "integer", "minimum": 1 }
      }
    },
    "version": {
      "type": "string",
      "pattern": "^gv-[0-9a-f]{12}$",
      "description": "Content-hash identity of this goal version (SPEC §11): gv-<sha256(normalized goal)[:12]>, computed over the goal with the lineage fields (version/supersedes/revision) removed and keys sorted. Self-verifying and commit-independent. Absent = the implicit unversioned baseline; the first /goal-writer --reshape mints the first explicit version."
    },
    "supersedes": {
      "type": ["string", "null"],
      "pattern": "^gv-[0-9a-f]{12}$",
      "description": "The version id this one supersedes in the append-only lineage, or null for the first version."
    },
    "revision": {
      "type": "object",
      "description": "What changed when this version was minted, and why. Provenance for the lineage; never part of the content hash.",
      "additionalProperties": false,
      "required": ["rationale", "changed", "date"],
      "properties": {
        "rationale": { "type": "string", "minLength": 1 },
        "changed": { "type": "array", "items": { "type": "string" } },
        "date": { "type": "string", "format": "date" },
        "alias": { "type": "string", "description": "Optional human alias (e.g. v2)." },
        "git_sha": { "type": "string", "description": "Optional git SHA where this version landed (provenance, not identity)." }
      }
    }
  }
}
